job_name,job_stars,job_category,job_description,company_name,company_type,company_size,company_industry,company_introduction,min_salary,max_salary,mid_salary,place,exp_years,education
文字编辑,"年底双薪,绩效奖金,交通补助,岗位晋升,全勤奖,带薪年假,餐饮补贴,五险,年终奖金,补充医疗保险",编辑,"岗位职责：,1、 负责展览策划、文字撰写、实施及相关项目的支持工作与执行 ,2、负责新媒体日常选题策划、协助新媒体推广、文案写作、采访以及编辑工作,3、负责书籍编辑、协助设计编辑工作,4、对艺术行业有一定的了解和知识储，备具备审美能力。,任职要求：,1、本科及以上学历，绘画、美术史论、艺术管理与策划等相关专业；,2、人品端正，具有较强的工作责任心，能吃苦耐劳；,3、具有美术史论功底、较高的文化素养和灵活的文字把控能力，能够独立完成杂志内容采写编；,4、擅长信息搜集与整合，能够通过各种途径收集和整理各种信息资源；,5、有对专题活动的策划能力，能够编写不同题材的文章；,6、工作经验不限",广东正典文化产业集团有限公司,民营公司,50-150人,"公关/市场推广/会展,影视/媒体/艺术/文化传播","正典—Canon，源于古希腊语，寓意正宗经典。正典成立于 2008 年,以“正行有道，以新致典”为经营宗旨，创造影响力为目标。现有正典广告，典胜文化，胜景环艺三个机构,主营品牌战略，文化传播，空间环艺等业务。以品牌创意及文化艺术传播为导向，并以跨界整合，创意管理，服务执行的运营平台，为政府与企业品牌项目提升价值，创造社会影响力。公司主要业务有文化艺术类、品牌创意策划类、艺术雕塑类、空间展示类、多媒体影视类等相关服务，主要以文化艺术传播和品牌创意策划为导向，其他业态为扶助的一站式服务体系，形成完善的整合传播服务平台：     一、文化艺术类：致力于高端艺术产业服务，自拥一所500多平方的艺术馆，定期举办各类艺术展览（中国画、油画、水彩、雕塑、陶艺等展览）及学术交流等文化活动。长期与广州画院、广州美术学院、广东省美术家协会、广东画院以及各高校艺术学院保持良好的合作关系，先后承办了全国画院院长邀请展暨广州画院三十周年系列展览、广东美协50周年、广州美术学院60周年、广州画院年度服务、广东省中国画学会年度服务、全国名家梅花邀请展、广东省各届当代油画艺术展等大型文化活动。与中国国家画院、广州画院、广州美术学院、共同推广运作“广州国家青苗画家培育计划”项目，并获得政府相关机构一同认可与赞扬。     二、品牌创意策划类：服务于品牌策划推广与年度服务，致力为企业建立优秀品牌，成功提升品牌附加值，曾服务于中海油集团、水电集团、广汽丰田、南方传媒、广东广播电视台、中国银行、三菱重工、长隆等品牌企业，目前与省环保厅共同打造“粤环保?粤时尚”环保品牌，并成立环保基金会，树立环保法的新形象。     三、艺术雕塑类：聘请多位国内知名雕塑家为艺术顾问，提供从前期策划到后期维护的全过程服务。致力于校园雕塑、城市雕塑、景观雕塑、石材雕塑雕刻等创作、设计、制作，一直与高校、政府机关具有相关业务来往，并屡获好评。成功案例：清远市飞来湖廉洁主题雕塑公园、广州市中级人民法院法文化建设雕塑项目、连州廉泉公园雕塑项目、阳山“清阳园”廉洁主题雕塑项目、广东女子职业技术学校校园文化雕塑项目、广州市南武中学校园文化雕塑项目、惠东县社会主义核心价值观主题雕塑公园、龙门县社会主义核心价值观主题雕塑公园、清远创文景观雕塑等。     四、空间展示类：专注艺术与空间的装饰设计与施工。利用3D现代技术，空间感与自身文化艺术资源特色相结合；拥有专业的设计团队，完美突破传统与现代相结合的艺术文化气氛。成功案例：广州画院美术馆、珠海杨匏安陈列馆、清远党建展示馆、广东省保密示范教育基地、     五、多媒体影视类：强力的硬件、专业的技术团队支持，拍摄企业形象宣传片、影视广告、产品演示片等，后期剪辑、动感特效、绚丽场景成为视频一大亮点。     凭其多年征战，正典从前期到售后形成一站式服务体系，承诺为客户提供“诚实、热情、信用、优质、快捷”的服务，洞悉客户所需，以一对一的贴身服务模式，竭诚为您提供***的服务！",4500.0,8000.0,6250.0,广州,1年经验,本科
展览设计师,"五险一金,员工旅游,交通补贴,年终奖金",展览/展示/店面设计,,南昌市朗迪威展览有限公司,民营公司,少于50人,"家居/室内设计/装潢,公关/市场推广/会展",南昌市朗迪威展览有限公司主要从事展厅、展览特装的设计制作，会展活动的策划实施。公司立足品牌运作和企业文化打造，是展览策划、创意、设计、实施为一体的专业展览公司。公司由在深圳从事展示设计策划、活动策划实施方面的资深专业人士组建而成。公司拥有近800平米的制作工厂，将独特的创意方案与超强的实施能力相互渗透，为每一位顾客呈现独一无二的品牌体验，卓越的诚信、周到的服务、优质的实施为我们注入蓬勃向上的发展动力，为每一个企业带来更直接品牌传播，更有效的品牌效益！我们拥有自己专业的施工团队，从方案策划、三维设计、平面设计到施工建造，来保证方案的整体性、原创性和可执行性。为客户提供全方位的立体服务。以节约客户的时间和资源。公司联系方式：0791-86188757联系地址：南昌市红谷滩新区红谷中大道凯旋门座2单元502,8000.0,10000.0,9000.0,南昌-红谷滩新区,1年经验,大专
3D设计师,"员工旅游,交通补贴,带薪年假,节日福利,周末双休","展览/展示/店面设计,包装设计","负责公司各类展览策划设计项目方案创意设计，3D效果图展现、施工图绘制。包括大型展会、企业展厅、地产包装、商业美陈装饰设计等项目。,任职资格：,1、专科及以上学历，艺术设计或者展览设计专业背景；,2、1年以上展览行业相关工作经验；,3、熟悉展览设计基本流程，能独立完成设计，了解基本设计和施工方法；,4、熟悉掌握3DMAX及vray渲染、CAD、Coreldraw、photoshop等设计软件并了解会展设计所运用的材料；沟通能力强，能快速准确领会方案的设计主题并恰当表现；,5、强烈的责任心，能深刻理解客户需求，能适应快节奏高强度的工作，具有独特创意及团队合作精神。,(有地产包装类工作经验优先考虑）,上班时间为：9：00—18:00，每周休一天半（周六下午及周日），底薪+提成+缴纳社保，公司不定期组织外出旅游。",南昌市朗迪威展览有限公司,民营公司,少于50人,"家居/室内设计/装潢,公关/市场推广/会展",南昌市朗迪威展览有限公司主要从事展厅、展览特装的设计制作，会展活动的策划实施。公司立足品牌运作和企业文化打造，是展览策划、创意、设计、实施为一体的专业展览公司。公司由在深圳从事展示设计策划、活动策划实施方面的资深专业人士组建而成。公司拥有近800平米的制作工厂，将独特的创意方案与超强的实施能力相互渗透，为每一位顾客呈现独一无二的品牌体验，卓越的诚信、周到的服务、优质的实施为我们注入蓬勃向上的发展动力，为每一个企业带来更直接品牌传播，更有效的品牌效益！我们拥有自己专业的施工团队，从方案策划、三维设计、平面设计到施工建造，来保证方案的整体性、原创性和可执行性。为客户提供全方位的立体服务。以节约客户的时间和资源。公司联系方式：0791-86188757联系地址：南昌市红谷滩新区红谷中大道凯旋门座2单元502,8000.0,10000.0,9000.0,南昌-红谷滩新区,1年经验,大专
文案策划（展览展示）,"五险一金,绩效奖金,年终奖金,周末双休,包吃,定期体检,员工旅游,专业培训,节日福利,带薪年假","文案/策划,编辑","1.  广阔的个人发展空间；,2.  平等独立的工作团队，灵活轻松的工作环境；,3.  具有竞争力的薪资待遇；,4.  令人艳羡的丰富团建；,5.  五险一金及其他绩效奖金；,6.  丰厚的项目奖金和年终分红。",无锡正邦国际会展有限责任公司,民营公司,50-150人,"公关/市场推广/会展,影视/媒体/艺术/文化传播",中国领先的展览全产业链服务提供商专注展览展示20年精于展览策划 聚焦会展营销      无锡正邦国际会展有限责任公司创立于1997年，现旗下拥有全资子公司无锡国际文化艺术产业博览交易会有限公司，近1000平米办公场所，2000多平米制作及仓储工场。      作为无锡重点文化企业，正邦国际会展以定制化综合设计为核心，以多媒体互动体验为依托，跨界融合创意设计，专注提供主题馆、科技馆、企业展厅等展陈空间规划设计、工程建设；全球临展创意设计搭建；专业品牌展览及会议主承办、大型展览及会议主场策划和展务服务；企业品牌视觉包装、高端活动策划执行；线上线下的文化艺术展览推广及培训研修等系列品牌开发与定制。      20年品牌铸炼，正邦国际会展始终坚持以“为客户秀出品牌价值”为宗旨，已成功为数百家知名企业、政府机构、大型展会提供过优质的服务。作为“中国无锡国际文化艺术产业博览交易会”与“中国无锡旅游产业博览交易会”创始单位及主体运营单位，我司致力于为我们优质的展商提供更广阔的交易平台，为专业观众展现丰富原创的展品与藏品，打造长三角最具市场竞争力的文化交易交流云城。      2019年，我司顺利通过“GB/T19001-2016/ISO9001:2015质量管理体系认证”、“GB/T24001-2016/ISO14001:2015环境管理体系认证”、“GB/T28001-2011/OHSAS18001:2007职业健康安全管理体系认证”三项管理体系认证。作为江苏艺术基金董事会首批董事会成员，我司同时拥有“展陈工程一级资质”、“资信AAA级等级证书”、“江苏省专业展览会AAA级等级证书”等资质，先后获得中国会展业“辉煌70年，中国品牌展览会金奖”、“中国十佳会展企业奖”、“中国十佳展览工程企业奖”等荣誉。      人才被视为正邦国际会展的***资源。公司注重“人才蓄水”、“梯队培养”、“人才开发”，拥有硕士研究生、欧美海归、无锡市唐鹤千卓越青年文化创意人才、国家一级会展策划师等优秀人才。公司依托高素质人才资源，高效的团队管理机制，运用独特创意理念、行业市场资源等竞争优势，成功完成一系列高规格、专业化的展览展示项目。      我们致力于打造出展览展示领域的“梦之队”，耀眼的成绩与令人振奋的作品是我们立足的基石，选择与这个“梦之队”站在一起，成为大家，成为我们。而现在，我们需要你！联系人： 薛小姐简历接收: lhcz_xue@163.com公司网址：http://www.wx-zb.com微信公众号：wxzb_hz,5000.0,8000.0,6500.0,无锡,3-4年经验,本科
资深平面设计师（无锡）,"五险一金,绩效奖金,年终奖金,周末双休,包吃,定期体检,员工旅游,专业培训,节日福利,带薪年假","平面设计师,展览/展示/店面设计","本职位工作地点在无锡,    ,    ,    ,    ,    ,    ,    ,    ,    ,    ,    ,    ,    ,    ,    ,    ,    ,    ",无锡正邦国际会展有限责任公司,民营公司,50-150人,"公关/市场推广/会展,影视/媒体/艺术/文化传播",中国领先的展览全产业链服务提供商专注展览展示20年精于展览策划 聚焦会展营销      无锡正邦国际会展有限责任公司创立于1997年，现旗下拥有全资子公司无锡国际文化艺术产业博览交易会有限公司，近1000平米办公场所，2000多平米制作及仓储工场。      作为无锡重点文化企业，正邦国际会展以定制化综合设计为核心，以多媒体互动体验为依托，跨界融合创意设计，专注提供主题馆、科技馆、企业展厅等展陈空间规划设计、工程建设；全球临展创意设计搭建；专业品牌展览及会议主承办、大型展览及会议主场策划和展务服务；企业品牌视觉包装、高端活动策划执行；线上线下的文化艺术展览推广及培训研修等系列品牌开发与定制。      20年品牌铸炼，正邦国际会展始终坚持以“为客户秀出品牌价值”为宗旨，已成功为数百家知名企业、政府机构、大型展会提供过优质的服务。作为“中国无锡国际文化艺术产业博览交易会”与“中国无锡旅游产业博览交易会”创始单位及主体运营单位，我司致力于为我们优质的展商提供更广阔的交易平台，为专业观众展现丰富原创的展品与藏品，打造长三角最具市场竞争力的文化交易交流云城。      2019年，我司顺利通过“GB/T19001-2016/ISO9001:2015质量管理体系认证”、“GB/T24001-2016/ISO14001:2015环境管理体系认证”、“GB/T28001-2011/OHSAS18001:2007职业健康安全管理体系认证”三项管理体系认证。作为江苏艺术基金董事会首批董事会成员，我司同时拥有“展陈工程一级资质”、“资信AAA级等级证书”、“江苏省专业展览会AAA级等级证书”等资质，先后获得中国会展业“辉煌70年，中国品牌展览会金奖”、“中国十佳会展企业奖”、“中国十佳展览工程企业奖”等荣誉。      人才被视为正邦国际会展的***资源。公司注重“人才蓄水”、“梯队培养”、“人才开发”，拥有硕士研究生、欧美海归、无锡市唐鹤千卓越青年文化创意人才、国家一级会展策划师等优秀人才。公司依托高素质人才资源，高效的团队管理机制，运用独特创意理念、行业市场资源等竞争优势，成功完成一系列高规格、专业化的展览展示项目。      我们致力于打造出展览展示领域的“梦之队”，耀眼的成绩与令人振奋的作品是我们立足的基石，选择与这个“梦之队”站在一起，成为大家，成为我们。而现在，我们需要你！联系人： 薛小姐简历接收: lhcz_xue@163.com公司网址：http://www.wx-zb.com微信公众号：wxzb_hz,5000.0,8000.0,6500.0,无锡,3-4年经验,大专
空间设计师（中高级）,"五险一金,年终奖金,绩效奖金,带薪年假,周末双休,包吃,节日福利,加班补贴,全勤奖,定期体检","动画/3D设计,展览/展示/店面设计","1、负责展厅展馆展台等展示展览的设计工作，能够准确把握策划的整体思路，对方案的整体风格与设计思路提出合理化建议；,2、在全面了解客户和项目的文化、理念、定位、特性等传播诉求的基础上完成展示空间设计；,3、根据客户的创意要求，合理分配工作时间，与相关部门沟通工作进程，在双方确认的时间段内完成创意稿；,4、与项目执行部门进行沟通，全面了解创意效果的可执行性以及实体部分与创意部分的表现差距是否在合理可控范围；,5、善于利用数字可视化手段，帮助客户在新媒体环境下与受众进行产品演示，提升客户品牌的视觉表现力；,6、定期收集各种创意设计素材，吸收优秀设计理念；负责设计档案的整理与保存。,1、设计、美术或相关专业，专科以上学历；,2、善于学习和分析,思维活跃、富有创意、充满激情, 拥有敏锐色彩感及把控能力, 能把空间整体风格与文化及色彩的关系很好的融为一体；,3、熟练掌握3DMax、PhotoShop、Illutrator等软件；精通建模、渲染，独立完成展台设计和效果图制作，施工图绘制规范；,4、有三年及以上相关展览展台设计经验，具备从事大中型展览设计的能力，并有成功案例者优先考虑；,5、熟悉展览展示制作工艺流程，对施工、材料有一定了解，擅长展览会展台的特装设计、施工图制作者优先考虑；,6、对品牌、客户有深刻的理解能力，独特的创意能力及团队合作精神，善于与人交流沟通，勇于接受挑战。,简历及个人作品可发至：lhcz_xue@163.com,正邦国际会展,专注展览展示20年,精于展览策划，聚焦会展营销",无锡正邦国际会展有限责任公司,民营公司,50-150人,"公关/市场推广/会展,影视/媒体/艺术/文化传播",中国领先的展览全产业链服务提供商专注展览展示20年精于展览策划 聚焦会展营销      无锡正邦国际会展有限责任公司创立于1997年，现旗下拥有全资子公司无锡国际文化艺术产业博览交易会有限公司，近1000平米办公场所，2000多平米制作及仓储工场。      作为无锡重点文化企业，正邦国际会展以定制化综合设计为核心，以多媒体互动体验为依托，跨界融合创意设计，专注提供主题馆、科技馆、企业展厅等展陈空间规划设计、工程建设；全球临展创意设计搭建；专业品牌展览及会议主承办、大型展览及会议主场策划和展务服务；企业品牌视觉包装、高端活动策划执行；线上线下的文化艺术展览推广及培训研修等系列品牌开发与定制。      20年品牌铸炼，正邦国际会展始终坚持以“为客户秀出品牌价值”为宗旨，已成功为数百家知名企业、政府机构、大型展会提供过优质的服务。作为“中国无锡国际文化艺术产业博览交易会”与“中国无锡旅游产业博览交易会”创始单位及主体运营单位，我司致力于为我们优质的展商提供更广阔的交易平台，为专业观众展现丰富原创的展品与藏品，打造长三角最具市场竞争力的文化交易交流云城。      2019年，我司顺利通过“GB/T19001-2016/ISO9001:2015质量管理体系认证”、“GB/T24001-2016/ISO14001:2015环境管理体系认证”、“GB/T28001-2011/OHSAS18001:2007职业健康安全管理体系认证”三项管理体系认证。作为江苏艺术基金董事会首批董事会成员，我司同时拥有“展陈工程一级资质”、“资信AAA级等级证书”、“江苏省专业展览会AAA级等级证书”等资质，先后获得中国会展业“辉煌70年，中国品牌展览会金奖”、“中国十佳会展企业奖”、“中国十佳展览工程企业奖”等荣誉。      人才被视为正邦国际会展的***资源。公司注重“人才蓄水”、“梯队培养”、“人才开发”，拥有硕士研究生、欧美海归、无锡市唐鹤千卓越青年文化创意人才、国家一级会展策划师等优秀人才。公司依托高素质人才资源，高效的团队管理机制，运用独特创意理念、行业市场资源等竞争优势，成功完成一系列高规格、专业化的展览展示项目。      我们致力于打造出展览展示领域的“梦之队”，耀眼的成绩与令人振奋的作品是我们立足的基石，选择与这个“梦之队”站在一起，成为大家，成为我们。而现在，我们需要你！联系人： 薛小姐简历接收: lhcz_xue@163.com公司网址：http://www.wx-zb.com微信公众号：wxzb_hz,6000.0,8000.0,7000.0,无锡,3-4年经验,大专
展陈策划师,"五险,员工旅游,交通补贴,餐饮补贴,通讯补贴,年终奖金,弹性工作","文案/策划,企业策划人员","岗位职责：,立项阶段：,1、负责为展厅博物馆项目的新建、重建、改造等编制项目建议书、预研究报告、可行性研究报告、展览策划意向书、博物馆整体规划等；,2、与客户进行深入沟通，充分了解客户在展厅博物馆建设、改造等方面的目标和需求；,3、根据客户目标和需求，收集梳理项目相关资料和信息，并跟踪分析项目情况。,策划阶段：,1、展览资料收集整理、展厅博物馆的大纲编制、展品征集；,2、阶段性向客户汇报项目情况，及时沟通，根据客户意见，及时修改策划大纲等；,3、和设计师、项目经理及时沟通，做好项目后续跟进及实施工作。,任职资格：,1、中文、新闻、历史、博物馆等相关专业大专及以上学历：,2、从事展厅博物馆：文橐策划工作三年以上，有同劲的博物馆策划案例；,3、具有较深厚的文字功底与文案撰写的能力，有较强的理解力和执行力；,4、有良好的口头表达能力，能准确把握客户需求，善于学习、聆听、理解、引导；,5、道德品质优良，工作态度端正；,6、具较强的团队协作精神，责任心强；,7、能接受短期出差。",百达文化科技有限公司,民营公司,150-500人,"影视/媒体/艺术/文化传播,家居/室内设计/装潢",欣百达装饰工程有限公司成立于2005 年，注册资金5050 万元，总部位于北京，合肥建有基地，浙江、云南、陕西、山东等地有分公司。公司主营展陈设计与施工，业务领域涵盖博物馆、地质馆、纪念馆、科技馆及各类展厅项目，拥有管理团队60余人，设计团队60余人，工程管理40余人，施工团队300余人。围绕展陈行业的相关服务，从展陈大纲编撰、沙盘模型、雕塑绘画、多媒体系统集成、动画制作、互动程序编写、文创产品开发、文物修复与复制到项目施工，积累了精湛的专业技术和丰富的管理经验，为客户提供全程优质的服务。      公司具有建筑装饰装修工程设计与施工壹级、博物馆陈列展览设计、施工单位壹级、展览馆协会展览设计、施工一级、建筑幕墙工程设计施工贰级、房屋建筑工程施工总承包叁级、钢结构叁级资质。通过了“ISO9001 质量管理体系”、“ISO14001 环境管理体系”及“OHSAS18001 职业健康安全管理体系”三位一体认证。公司先后承建了中国港口博物馆、中国地质博物馆百年馆庆回顾展、云南省博物馆、四川攀枝花三线建设博物馆、曲靖市博物馆、通化自然馆等一批博物馆项目，中国有色集团展厅、北仑城市展示馆、山东淄博新材料展厅等一批展厅项目，月星家居建材卖场公共区域装饰工程、黄山旅游广场三期天都大厦等一批公装项目。近年来多次获得建筑工程装饰奖、AAA 级建筑业质量安全信誉优秀施工单位、全国工程建设典范企业等奖项。,4000.0,10000.0,7000.0,合肥-庐阳区,1年经验,本科
策划助理,,文案/策划,,江苏美基文化发展有限公司,民营公司,少于50人,"广告,公关/市场推广/会展",Development美基发展过去PAST踏踏实实做人，实实在在办事。美基成立于2009年，前身是2007年创办的天狼星视觉。三年来，我们的所走的每一步、所做的每一个案例都见证了公司的发展历程，也充分体现了公司踏实的作风！现在NOW和其他创业者一样，美基也面临了许多发展的障碍！但是，四年的磨练奠定了公司的核心发展理念——以创意求共赢，以创新求发展！ 我们坚信：美基即将迎来新一轮的关键性的发展时期！将来FUTURE以预见创造未来！我们不能预见未来，但是，只要坚持预见，智慧创造，未来一定属于——我们！,8000.0,10000.0,9000.0,南京-建邺区,3-4年经验,本科
