job_name,job_stars,job_category,job_description,company_name,company_type,company_size,company_industry,company_introduction,min_salary,max_salary,mid_salary,place,exp_years,education
展示策划,"五险,周末双休,带薪年假,交通补贴,节日福利,绩效奖金,通讯补贴",文案/策划,"岗位职责：,1、负责展厅项目（如政府规划馆、博物馆、企业展厅、各类主题展馆等）相关展馆的理念、内容等创意策划；并针对客户需求进行方向确定、整体策划、提案；文案的策划、创意、撰写与执行（尤其是创意脚本）；设计过程中的管控和进度推进，如：时间节点、多方沟通协调、汇报；项目案场效果跟进；,2、独立跟进项目，负责向客户提案讲解，参与项目招投标流程；,3、参与项目考察及前期调研工作，并进行相关资料的收集与整理；,4、能够统筹完成各类大案的整体创意构思和总体思路、能够有效的把握项目进程；,5、根据策划方案指导设计人员进行空间、平面等设计工作。配合市场客服部工作需要，和相关人员完成客户需求；,6、文笔流畅，善于撰写脚本创作，有较强的文字驾驭能力和创意能力；具有较强的分析判断能力文字组织能力、方案策划能力、谈判能力以及公关能力；,7、对展厅类项目有较好的见解，能完成大型展览展示创意策划；,8、用PPT、WORD等制作策划方案；,岗位要求：,1、大专以上学历，会展策划、多媒体艺术、空间设计、广告传播、中文等相关专业；,2、4年以上策划工作经验；2年以上大型展馆（规划馆、博物馆、科技馆、主题馆等）主案策展经验；对展厅类项目有较好的见解，能完成大型展览展示策划设计；能够准确了解客户要求，把握策划方向；,3、有较强的理解能力、策略分析能力、文字撰写能力、协调能力；责任心强；较强的PPT制作能力；具有一定的审美；对新的互动科技有兴趣；,4、诚实敬业，有激情、工作认真负责，责任心强，具备较强的团队合作精神，思维活跃积极向上；,5、根据策划方案指导设计人员进行空间、平面等设计工作。配合市场客服部工作需要，和相关设计人员完成客户需求；,6、文字功底深厚，具有独立提案能力；",重庆曼斯特科技有限公司,民营公司,50-150人,计算机软件,曼斯特科技成立以来一直专注于数字多媒体展示服务与前沿科技的数字展示领域的实践。跨界整合，确立了“数字化展厅、新媒体艺术、大数据可视化”三大业务板块，是西南地区数字化展示领域的先行者。 欢迎有想法，有能力，敢于创新的你加入我们。,8000.0,10000.0,9000.0,重庆-渝北区,2年经验,大专
展陈策划,"五险一金,员工旅游,出国机会,绩效奖金,年终奖金,定期体检",文案/策划,"1、收集、整理项目资料，并依项目需求，形成策展方案或大纲，编制展览方案和文本；,2、参与、指导项目方案设计；,3、开展项目研究，撰写与项目有关的专业论文；,4、协助配合公司其他部门进行相关业务工作；,5、完成公司交办的其他工作。,任职要求：,1、  大学本科以上学历，必须有二年以上工作经验；有历史、考古、博物馆、中文、传媒等专业背景者优先；,2、  必须具有博物馆展陈工作经验，有实际展陈项目策划、大纲编写等相关经验，或具有展览展示、会展、广告、传媒等行业工作经验；,3、  具有宽泛的知识背景，出色的语言文字组织能力，优秀的沟通技巧；,4、  能承受工作压力，能接受加班、出差。",上海华成实业有限公司,民营公司,50-150人,"建筑/建材/工程,家居/室内设计/装潢",上海华成实业有限公司（原上天禹神鸣装饰设计工程有限公司），是国内顶尖的博物馆陈列展示服务商。在上海、湖北设有分支机构。我们致力于为中国博物馆展陈提供更有创意、更有新意的设计，追求具有世界眼光、并且更符合中国实际、契合博物馆要求的展陈方案。我们的业务，涵盖展陈工程的策划、文案、设计、制作、实施等环节，以及各专业项目与展览设备。经过十年耕耘，我们已经成为覆盖展陈业全业务、全流程，并连接沟通上下游产业的一站式展陈专业综合服务商。    十年来，我们已在全国各地成功完成了百余家博物馆、纪念馆陈列布展项目，遍布大江南北、长城内外。我们承担的项目多次荣获“全国博物馆十大陈列展览精品”奖及省市级精品奖，得到政府主管部门的高度认可及社会大众的广泛好评。作为行业的主流公司之一，上海华成已成为展陈业知名品牌，成为国内博物馆陈列项目招标的重点邀请单位。我们以“呈现文明”为愿景与使命，与博物馆行业共同成长。我们期待着以专业精神和创意设计，为中国博物馆事业贡献力量。资质建筑装修装饰工程专业承包壹级工程设计建筑装饰工程专项乙级中国博物馆协会展览设计甲级资质中国博物馆协会展览施工壹级资质中国展览馆协会展览工程企业一级资质中国展览馆协会展览工程设计、施工一体化一级资质中国会展经济研究会展览展示陈列工程设计、施工一级资质ISO质量管理体系认证（装饰工程设计与施工）ISO质量管理体系认证（文博类）ISO环境管理体系认证ISO职业健康安全管理体系认证近年奖项2016年度 第十四届全国博物馆十大陈列展览精品优胜奖江汉朝宗——武汉城市现代化历程（江汉关博物馆）2016年度 上海市博物馆陈列展览精品奖八百壮士与四行仓库保卫战（上海四行仓库抗战纪念馆）徐光启纪念馆基本陈列（徐光启纪念馆）上海市银行博物馆新馆陈列布展项目（中国近现代金融史陈列）——（上海市银行博物馆）2014年度 援藏突出贡献奖 江孜县抗英纪念馆（历史文化陈列馆）2013年度 上海市博物馆陈列展览优秀奖中共四大史料陈列展（中共四大纪念馆）2012年度 上海市博物馆陈列展览精品奖上海——红色之源纪念中国共产党成立90周年文物史料展（中共一大会址纪念馆）2012年度 上海市博物馆陈列展览组织奖共和国领袖的青少年时代（陈云故居纪念馆）2011-2012年度 第十届全国博物馆十大陈列展览精品奖“人之子”—鲁迅生平陈列（上海鲁迅纪念馆） 2011年 湖北省博物馆、纪念馆优秀陈列展精品奖 《一代名舰》中山舰史迹陈列（武汉中山舰博物馆）2011年 湖北省博物馆、纪念馆优秀陈列展精品奖共和之基（辛亥革命博物馆）2009-2010年度 上海市博物馆陈列展览评选精品奖上海会馆史陈列（三山会馆）土山湾历史文化陈列（上海土山湾博物馆）优秀案例上海市历史博物馆西安市博物院昆明市博物馆厦门市博物馆良渚博物院武汉江汉关博物馆世博会博物馆2010上海世博会城市实践区西安馆2010上海世博会韩国企业联合馆上海元代水闸遗址博物馆上海崧泽遗址博物馆西安大明宫丹凤门遗址博物馆  中共三大后中央局机关历史纪念馆中共四大会址纪念馆中共五大会址纪念馆福建省革命历史纪念馆云南陆军讲武堂纪念馆四行仓库抗战纪念馆上海鲁迅纪念馆广东孙中山故居纪念馆 辛亥革命纪念馆辛亥革命博物馆武汉中山舰博物馆武汉市辛亥革命博物馆昆明市飞虎队纪念馆上海银行博物馆中国会计博物馆,6000.0,10000.0,8000.0,上海-黄浦区,2年经验,硕士
陈列经理（NBA）,"做五休二,周末双休,弹性工作,交通补贴,节日福利,专业培训,带薪年假,五险一金","陈列管理,展览/展示/店面设计","岗位职责：,-负责打造店铺形象,-根据品牌的产品风格和定位，负责店铺的软装氛围、服装陈列的总体策划、陈列手册的制作、培训、执行与实施监督；,-负责店铺内画面、海报、灯箱画、POP设计方案与更换执行监督，跟进后期印刷制作及安装工作等；,-负责店铺节日、各商场大型活动期间的卖场氛围营造及店内外展示橱窗、Dp的设计，及其方案实施、物料采购、布置、培训、执行工作；,-每季陈列指引的制作，根据门店所需设计相关课程并有效组织培训，提升店铺陈列知识与美感,-协调并执行店铺内所有与视觉相关的事务，负责陈列道具开发和管理及分发；,-完成上级交办的其他工作。,任职资格：,-本科及以上学历，服装设计、服装营销、平面设计、陈列展览设计 以上专业优先；,-Fashion/Lifestyle 相关工作经验及海外留学经验者优先考虑；,-对卖场陈列、空间布局、橱窗设计、软装道具、视觉营销、数据分析等有一定的专业见解；,-熟悉使用各类设计软件（Photoshop, AI, Sketch Up ，Cad，InDesign…）,-从事exhibiton, art,fashion等甲方品牌方展陈、空间、橱窗等设计经验，或美术馆、艺术策展相关行业展陈空间设计从业经验；熟练掌握色彩知识及搭配，了解时尚信息与潮流趋势；,-较好的视觉表现，审美能力，创新表现等能力，对艺术设计行业的广泛认知把握；具有很好的沟通和协调能力，统筹多方工作；具备较强的协调、沟通、表达能力及出色的动手能力与学习能力。",百丽集团体育事业总部,外资（非欧美）,10000人以上,"批发/零售,服装/纺织/皮革",滔搏投资（上海）有限公司为百丽国际控股有限公司旗下成员，是百丽国际体育事业部的总部，负责对体育事业部全国九家分公司进行管理、监督、指导和支持。滔搏成立于2002年，是中国最具竞争力的体育用品零售商在中国设有九家分公司，拥有8000余家零售网点（体育用品类），员工约40000多名拥有多个国际运动品牌的经销权：NIKE、Adidas、PUMA、Converse、Timberland、Vans、Asics、Columbia、The North Face……Adidas全球***大客户、NIKE全球第二大客户于2011年开办首家TOPSPORTS多品店，现设有TOPSPORTS多品店近30家拥有以销售潮流鞋、时尚配饰为主的T+时尚潮流集合店近20家    未来，滔搏将致力于成为世界一流的综合体育运动用品零售管理机构，为顾客提供专业的运动产品、设备与服务，让人们更好地体验运动乐趣、享受积极健康的生活方式。    我们需要这样的你——与我们一起投身运动用品零售领域，                                     感受运动时尚魅力，                                     尽享运动乐趣，享受快乐的工作时光。,25000.0,30000.0,27500.0,北京-东城区,8-9年经验,本科
公关接待,"五险一金,交通补贴,绩效奖金,年终奖金,定期体检",公关专员,"[隶属于海信集团有限公司-品牌管理部 展项与终端室],岗位职责：,1. 接待国内外政要、商界来宾和其他访客，负责日常的展馆内的参观讲解；,2. 熟知海信各产业板块前沿科技和最新产品并与海信各分公司对接；,3. 负责展馆日常运营维护、产品翻译、展陈更新、策展活动等工作（提供相关培训）；,4. 完成集团品牌管理部其他工作，如大型公关活动，媒体会议等。, ,任职资格：,1. 学历：全日制本科及以上学历，硕士学历、海外留学硕士及以上学历优先；,        （实习生要求实习期4个月及以上，可开具实习证明）,2. 普通话标准、有较强的口语表达能力，英文达到四级及以上水平；,3. ***身高178cm以上，***身高166cm以上；气质好、形象佳、相貌端庄、态度亲和；,4. 专业：不限（播音主持、市场营销、管理类优先）；,5. 认真负责、具有主动学习意识、团队精神和沟通协调能力。,[请提供中文个人简历，并附带三张全身照至邮箱：hxzgzx@hisense.com]",海信集团有限公司,国企,500-1000人,"电子技术/半导体/集成电路,通信/电信/网络设备",海信集团是特大型电子信息产业集团公司，成立于1969年。海信坚持“技术立企、稳健经营”的发展战略，以优化产业结构为基础、技术创新为动力、资本运营为杠杆，持续健康发展。进入21世纪，海信以强大的研发实力为后盾，以优秀的国际化经营管理团队为支撑，加快了产业扩张的速度，已形成了以数字多媒体技术、现代通信技术和智能信息系统技术为支撑，涵盖多媒体、家电、通信、智能信息系统和现代地产与服务的产业格局。2011年海信实现销售收入716亿元，在中国电子信息百强企业中名列前茅。海信拥有海信电器（600060）和海信科龙电器（000921）两家在沪、深、港三地的上市公司，是持有海信（Hisense）、科龙（Kelon）和容声（Ronshen）三个品牌的企业集团。海信电视、海信空调、海信冰箱、海信手机、科龙空调、容声冰箱等海信产品畅销海内外 。海信在青岛、深圳、顺德、美国、比利时等地建有研发中心，初步确立全球研发体系。科学高效的技术创新体系，使海信的技术创新工作始终走在国内同行的前列。目前，海信在南非、埃及、阿尔及利亚等地拥有生产基地，在全球设有15个海外分支机构，产品远销130多个国家和地区。,6000.0,8000.0,7000.0,青岛-市南区,2年经验,本科
医疗健康大数据顾问,"五险一金,交通补贴,餐饮补贴,通讯补贴",大数据开发工程师,"  ,  ,  ,  ,  ,  ,  ,  ,  ,  ,  ,  ",上海物联网有限公司,国企,50-150人,"通信/电信/网络设备,电子技术/半导体/集成电路",上海物联网有限公司是由中科院上海微系统所、上海交通大学、上海大学、华东计算技术研究所、电信一所、中科院浦东高等研究院和嘉定区政府等单位共同发起建立，是一家集科研、应用推广、产业孵化、知识产权运作和维护的具有先进性、创新性的智力型企业。公司坐落于上海市嘉定区***科研院所集聚区。公司将瞄准物联网产业，着重建设三个基地和一个平台，即：物联网核心技术研发基地、物联网技术应用示范基地、物联网高端产业孵化和集聚基地、物联网产业公共研发平台。公司目前正处于业务高速发展之际，现面向社会诚聘英才。一经录用将提供优厚的薪资和良好的福利待遇，欢迎各界英才前来一展宏图。我们期待每一位渴望成功的年轻人加入我们的团队。,20000.0,40000.0,30000.0,上海-长宁区,5-7年经验,本科
市场专员+双休+五险一金+提成,"五险一金,员工旅游,专业培训,出国机会,绩效奖金,定期体检,带薪假期",市场/营销/拓展专员,"1、根据部门总体招生计划、营销推广策略执行区域市场的招生计划。,2、执行详细的渠道和宣传推广工作计划。,3、发展各个聚道，并严格按照公司渠道合作政策展开合作事宜。,4、熟悉了解学校周边的商圈，根据学校招生计划安排，完成月度、季度的招生指标。,5、全面掌握本区域市场的变化和竞争对手情况并及时汇报。,6、通过各种方式挖掘学生资源，收集潜在学生信息。",海伦奥格雷迪戏剧学院,民营公司,少于50人,"教育/培训/院校,影视/媒体/艺术/文化传播","海伦奥格雷迪戏剧学院（Helen O' Grady Drama Academy）1979年成立于澳大利亚，39年来海伦奥格雷迪(Helen O'Grady)分支机构遍布世界41个国家和地区开设1500多家分支机构，学员人数超过600万，现在全球每周有70000多名青少年儿童参与我们的课程。遍及美国、英国、爱尔兰、澳大利亚、新西兰、南非、欧洲、印度尼西亚、马来西亚、印度、新加坡、中国等国家。目前是全球儿童戏剧教育领域内规模***的教育机构。海伦奥格雷迪戏剧学院拥有全球领先的教学体系，通过寓教于乐的全英文戏剧教育模式，为全球2-17岁青少儿家庭提供国际化、多元化、创新与趣味为一体的高品质戏剧教学服务，培养孩子们乐观积极的心态、树立自信，建立同理心。帮助孩子们发现自我，激发自己的感知力、想象力、创造力，提高孩子们的沟通和社交能力，挖掘孩子们对于戏剧的兴趣，将他们导入自我发展的课程中。 2006年，海伦奥格雷迪正式进入中国，为3-17岁儿童，解开戏剧教育神秘的面纱。 2019年，海伦?奥格雷迪进入中国西南地区-成都，与成都的孩子们共享戏剧的魅力。你也热爱戏剧吗？我们将为您提供 1、专业体系培训； 2、定期有趣的团队活动，年度旅游及带薪寒暑假期； 3、优越的工作环境，广阔的发展空间及优厚的薪资福利待遇。 同时我们也欢迎愿意投身教育事业的优秀应届毕业生加入。Helen O' Grady Drama Academy was established in Australia in 1979. Up to now, there are more than Helen O' Grady 1500 branch schools and over six million students in 32 countries and regions. There are more than 70,000 children and teenagers participating in our drama lesson around the world every week. Our lesson spread to USA, England, Ireland，Australia, New Zealand, South Africa, Indonesia, Malaysia, India, Singapore and China. Helen O’Grady is largest education institution in the drama education for young children worldwide. The primary goal of Helen O’Grady drama lessons is build the self-confident and empathy. From the well-designed drama lessons, children can explore their creative potential and interest of acting. The potential and interest will lead children have their own self development. In 2006, Helen O' Grady was officially introduced into China and uncover the mystery of drama education for children and teenagers. In 2019, Helen O' Grady will be introduced in Chengdu to share the charm of drama to all the children here. If you are the one also loves drama? We will provide you: 1. Professional training; 2. Regular and interesting team activity, annual team building tourism and annual leaves. 3.  Excellent working environment, promotion opportunity and compensation and benefits. We also welcome excellent graduates who are willing to apply yourselves to an educational career.",6000.0,8000.0,7000.0,成都-青羊区,,
资深展馆策划/高端展览策划/博物馆策划/展陈文案,"五险一金,员工旅游,弹性工作,年终奖金,绩效奖金","文案/策划,展览/展示/店面设计","1、 对展馆概念的策划，拟定富有创意和内涵的展览主题；,2、 大型展览馆可行分析、概念定位、策划大纲撰写；,3、 搭建整个展馆展示内容框架，合理规划各展厅（区）主题及相应内容，明确内在逻辑线索；,4、 对各展厅（区）内容作出描述或阐释，使设计部门明白展示点分布和展示线索，以便作出合理的设计。,5、 国内竞争对手情报分析与竞争对策；,6、 建立全球优秀展览馆艺术、策划、技术资料库；,应聘要求：,1、本科及以上学历，广告策划、中医文化、艺术设计、会展策划、历史考古类专业优先；,2、具备五年及以上大型展览馆策划工作经验，拥有成功策划案例者优先；,3、具有深厚的文字功底及团队协作精神，有独到的创新意识；,4、能独立编撰展览馆策划方案，善于沟通，精于提案；,5、能承受压力，能适应出差。",上海汲古文化传播有限公司,民营公司,少于50人,影视/媒体/艺术/文化传播,上海汲古文化传播有限公司坐落于浦东陆家嘴地区，是一家专业从事中医文化设计的公司，业务范围涵盖中医院、中医门诊、中医会所、中药店、中医药博物馆、中医药企业学校等中医空间设计、中医文化建设，同时还涉及软装设计、工艺礼品开发、中药标本创意研发等。,15000.0,20000.0,17500.0,上海-浦东新区,3-4年经验,大专
企划设计专员,"绩效奖金,高温补贴,社保,周末双休","企业策划人员,平面设计师","1、负责“线上”（自媒体网络平台）和“线下”（IBD门店）两个“道场”的规划、设计和制作输出支持；,2、负责品牌及产品行销、市场推广方面的PR活动策划及执行；,3、负责所有平面设计工作（宣传单页、宣传册、海报、展架、自媒体发布图片处理等）；,4、负责公司企宣品的设计、印刷、制作及费用申报；,5、负责新零售战略的执行、负责内容和体验的提炼和自媒体创新运营工作(如微信公众号编辑运营等)；,6、TPM的执行、配合主管相关工作要求，达成团队KPI;,任职资格：,1、综合美学基础、较强的平面设计能力、精通平面设计软件(Photoshop/CorelDRAW/AI)并熟练操作；,2、客户服务导向和任务导向，具备基本的CAD应用，对门店终端设计和主题展陈输出制作支持有基本经验；,3、认同并欣赏“责任、态度、上进心”三要素，及“需求“为导向设计创意沟通能力，具有较强的学习能力；,4、认同并欣赏内容和体系的为核心的新零售，并结合“O+O""创新应用支持；,5、具备一定的活动策展和文案写作能力，有较高的审美观与品味；,6、了解本公司的产品和服务（或通过培训和学习），较强的责任心和团队合作意识；,7、对自行车等综合户外运动有一定的认知，欣赏和热爱骑行或户外运动者***。,工作时间：,8:30-17:30，双休",宁波巨大商业品牌管理有限公司,民营公司,少于50人,"批发/零售,娱乐/休闲/体育","秉持“全球品牌，当地经营；各地成功，全球支援”的新世纪经营哲学，以生产并行销世界知名自行车品牌---捷安特（giant）而享誉全球的台湾巨大集团，于1992年10月8日选定在江苏省昆山市经济技术开发区设立捷安特（中国）有限公司。    捷安特自创业以来，不断以“全球品牌、当地深根”的行销策略，贯彻发展国际品牌为总体目标，并以坚持创造与生产***化综合价值的产品及服务，来满足全球消费者的需求。    宁波巨大商业品牌管理有限公司前身是台湾巨大集团旗下的捷安特（中国）有限公司宁波销售部。2008年初，捷安特宁波公司成功转型为私营企业，转制成功后，宁波巨大商业品牌管理有限公司作为捷安特（中国）有限公司宁波和舟山地区总代理，负责宁波和舟山大区域市场的giant品牌运营和管理。我们不仅仅只提供高品质的产品,更是total cycling solution--两轮生活的解决方案的提供者,从“分享骑乘的乐趣”到“启动探索的激情”,积极倡导并持续推动自行车的新生活文化。",5500.0,6500.0,6000.0,宁波,2年经验,大专
