job_name,job_stars,job_category,job_description,company_name,company_type,company_size,company_industry,company_introduction,min_salary,max_salary,mid_salary,place,exp_years,education
展厅展馆策划/规划师,"五险一金,员工旅游,餐饮补贴,绩效奖金,年终奖金","文案/策划,企业策划人员","职位描述：,1、负责展览展示项目创意方案策划；,2、独立完成创意策划概念和稿件思路规划；,3、具备展厅、博物馆、科技馆、主题馆、多媒体展厅等相关展示创意策划的工作经验，并提供成功案例；,4、全面深刻的理解客户的文案要求，并与客户进行有效的沟通；,5、协助团队进行对外的提案演示。,任职资格：,1、专科以上学历，会展策划、 广告 、中文等相关专业优先考虑；,2、熟练运用PPT、 PS 、PDF等办公软件 ；,3、具备良好的逻辑思维能力，较强的审美能力， 独特的创意思路；,4、熟悉施工材料、工艺、 场景营造、 多媒体技术的运用。",上海帝盟展览服务有限公司,民营公司,少于50人,"公关/市场推广/会展,家居/室内设计/装潢",帝盟成立于2003年，专业从事展览会、企业展厅、商业美陈的设计与施工。    十七年来，我们一直坚持专业化的服务路线，把“创新、专业”作为公司的核心价值观。2007年通过国家ISO9001：2000质量管理体系认证，2008年被会展行业协会评为展示工程企业一级资质，2014年被中国展览馆协会评为“展览陈列工程设计与施工一体化一级资质”和“展览工程企业一级资质”，2019年取得建筑装饰工程贰级资质。我们一直认为坚持高品质是公司发展的硬道理，并一直为此努力。我们每进入一个新的行业，都希望成为该领域的专业团队！十五年来，我们在房产展，建材卫浴，电动车和新能源方面已成长为优质品牌的展览公司。此外，还涉及的行业有：工程机械、汽车配件、工博会、家电展、孕婴童用品等展会。   帝盟不仅在展览会行业取得了一定的成绩，我们的团队还致力于企业展厅、规划馆、科技馆、博物馆等领域的服务工作，帝盟在行业的良好信誉给我们的发展带来持续的动力。    现因业务发展需要，现诚聘英才。公司全员缴纳社会保险、公积金，并提供具有竞争力的薪金待遇。    办公地址：徐汇区肇嘉浜路807号（五洲国际大厦）19A展览案例：1. 在房地产行业内，上海帝盟是有口皆碑的展览设计搭建供应商。帝盟服务过绿地、万达、万科、中海、保利、招商局等房地产公司2. 电动车及电动汽车等新能源领域内提供了专业的设计服务，服务的客户有：新日、雅迪、新蕾、比德文、立马、台铃、赛克、宝岛、绿能、绿驹、绿源、新大洲、新大阳、金彭三轮车、雷丁汽车等3. 陶瓷卫浴展会领域内，因产品特点从设计到施工有很专业的要求。帝盟在过去的几年里服务过箭牌、法恩莎、安华、九牧、欧路莎、英皇卫浴、viv、宏浪、朗斯等知名卫浴品牌4. 上海帝盟亦有涉足工业类展览会领域。曾为铁拓机械、北方玻璃、万新光学、京龙工程机械和捷太格特等知名厂商提供展览设计搭建服务5. 在车展设计领域内，帝盟曾与多个知名汽车品牌合作，创造出符合品牌形象与车款性格的展台展厅，包括宝马汽车、雷丁汽车、众泰汽车、一汽、中通6. 帝盟为政府部门和企事业单位完成了众多厅馆类项目，涵盖规划展示馆、企业文化和产品展厅等。包括：无锡万达广场店铺的设计与施工；华泰证券企业展厅；苏州纽威集团企业展厅；亭湖区低碳社区体验展示中心；万达品牌馆等,10000.0,15000.0,12500.0,上海-徐汇区,3-4年经验,大专
高级策划师（底薪+项目奖金）,"五险一金,商业保险,在职培训,带薪年假,节日福利,季度旅游",活动策划,"【底薪：6000元-7000元+项目奖金（年薪：12w-15w）】,岗位职责：,1、负责组织策划统筹如：发布会、推荐会、开盘、暖场、商业活动、政府活动、展会展览展示、演唱会、等中大型规模公关活动；,2、与客户进行前期沟通，撰写创意性活动策划案并向客户进行初步提案；,3、细化报价清单，活动执行流程及执行方案，物料准备、节目审编；,4、向项目组正确传达客户的要求及需求，引导设计师和执行人员进行相关的设计及制作；,5、负责活动的整体统筹、活动现场的把控，突发事件的处理，现场客户沟通，活动结束后的客户反馈收集、验收等。,职位要求：,1、25-35岁；,2、活动策划行业三年以上经验（不含在校实习阶段）；,3、文笔优美、理解及沟通能力强，有良好的审美观；,4、有亲和力，具备良好的沟通能力和执行能力，能承受一定的工作压力；,5、反应灵活，能很好地解决现场突发情况；,6、有良好的团队合作能力和高度的责任感，有敢于挑战新事物的创新精神；,7、汉语言文学、会展策划与管理、市场营销、广告学、新闻学、传播学等专业优先录用。,公司福利：,1、五险一金，商业保险，节日福利，季度旅游，带薪年假，在职培训；,2、外出活动打车费报销，活动跟进期间工作餐；,3、择优安排省外学习如【杭州造物节】、【上海美陈展】、【中国广告节】等；,4、完成相应指标可获得境外考察机会。",东莞市悦成传媒有限公司,民营公司,少于50人,公关/市场推广/会展,纵横珠三角十几年的跨界公关活动公司、中国区域公关公司20强、中国房地产公关公司权威榜排名前二十位、政府机关指定服务公关公司。以公关、传媒、广告、营销策划、文化产业为主导的集团化企业。始创于2003年，本部设在深圳，辐射珠三角地区的集团化运作模式，囊括全国各地的资深房地产营销策划人。深圳市威派文化传播有限公司，将高执行力和有效的项目管理与东莞市悦成传媒有限公司及途胜广告传播融合，为房地产行业提供基于有效执行的全面公关解决方案。公司福利：双休，五险一金，外出活动打车费报销，活动跟进期间工作餐，每年两次省内旅游，带薪年假等。威派文化网址：http://www.szwp.net/,6000.0,7000.0,6500.0,东莞-南城区,3-4年经验,本科
策划总监（底薪+项目奖金）,"五险一金,商业保险,在职培训,带薪年假,节日福利,季度旅游",活动策划,"【底薪：8000元-10000元+项目奖金（年薪：15w-20w）】,岗位职责：,1、负责组织策划统筹如：发布会、推荐会、开盘、暖场、商业活动、政府活动、展会展览展示、演唱会、等中大型规模公关活动；,2、与客户进行前期沟通，撰写创意性活动策划案并向客户进行初步提案；,3、细化报价清单，活动执行流程及执行方案，物料准备、节目审编；,4、向团队正确传达客户的要求及需求，引导设计师和执行人员进行相关的设计及制作；,5、负责活动的整体统筹、活动现场的把控，突发事件的处理，现场客户沟通，活动结束后的客户反馈收集、验收等；,6、项目组出品监督、协助跟进团队“传帮带”等工作。,职位要求：,1、28-35岁；,2、活动策划行业五年以上经验（不含在校实习阶段），有15-20人管理经验；,3、文笔优美、理解及沟通能力强，有良好的审美观；,4、具备良好的沟通能力和执行能力，资源整合能力，能承受一定的工作压力；,5、反应灵活，能很好地解决现场突发情况；,6、有良好的团队合作能力和高度的责任感，有敢于挑战新事物的创新精神；,7、具备经营性思维，除策划能力专业，亦可应对客户关系处理等问题；,8、汉语言文学、会展策划与管理、市场营销、广告学、新闻学、传播学等专业优先录用。,公司福利：,1、五险一金，商业保险，节日福利，季度旅游，带薪年假，在职培训；,2、外出活动打车费报销，活动跟进期间工作餐；,3、择优安排省外学习如【杭州造物节】、【上海美陈展】、【中国广告节】等；,4、完成相应指标可获得境外考察机会。",东莞市悦成传媒有限公司,民营公司,少于50人,公关/市场推广/会展,纵横珠三角十几年的跨界公关活动公司、中国区域公关公司20强、中国房地产公关公司权威榜排名前二十位、政府机关指定服务公关公司。以公关、传媒、广告、营销策划、文化产业为主导的集团化企业。始创于2003年，本部设在深圳，辐射珠三角地区的集团化运作模式，囊括全国各地的资深房地产营销策划人。深圳市威派文化传播有限公司，将高执行力和有效的项目管理与东莞市悦成传媒有限公司及途胜广告传播融合，为房地产行业提供基于有效执行的全面公关解决方案。公司福利：双休，五险一金，外出活动打车费报销，活动跟进期间工作餐，每年两次省内旅游，带薪年假等。威派文化网址：http://www.szwp.net/,8000.0,10000.0,9000.0,东莞-南城区,5-7年经验,本科
执行经理,"通讯补贴,绩效奖金,年终奖金,五险,节假日福利,弹性工作,生日津贴,员工旅游",活动执行,"任职要求：,1、大学专科及以上学历，市场营销、会展策划、广告学专业优秀考虑；,2、三年以上活动项目执行工作经验，一年以上管理工作经验；,3、熟练操作Office软件，能应用AI等绘图软件者优先；,4、具备良好的心里素质，积极的处事态度和团队意识；,5、面对困难可保持积极心态，并可主动提出灵活的解决方案；,6、有较强的沟通及理解能力，可与客户、供应商、同事之间有良好的有效沟通；,7、思路清晰、逻辑性强、拥有良好的团队合作精神及客户服务意识；,8、工作积极主动，有责任心，能有独当一面的执行能力。,岗位职责：,1、负责活动场地的勘查、制作搭建，活动中所需供应商的报价、沟通等工作；,2、对活动项目修改、执行流程改善意见；,3、负责活动执行团队的基础培训及讲解，现场执行及时给予优化建议；,4、负责活动执行组织与落地，根据活动的规模及详细需求，做好前期筹备工作，选定供应商及其组织落地工作；,5、熟悉各类常规物料价格，控制项目成本，具备和供应商以及客户的沟通能力；,6、参与活动现场的管理，解决突发问题，并管理好现场活动执行团队，协调各方关系；,7、负责活动的效果评估，并整理工作总结报告；,8、负责活动总费用及毛利的管控。",福州策元第文化传媒有限公司,民营公司,50-150人,"公关/市场推广/会展,影视/媒体/艺术/文化传播","策元第公关机构：一个八零、九零后的团队，不仅具备专业的活动策划和运作能力，更有十年以上营销职场历练的沉淀，把市场营销、企业管理、品牌推广贯穿到公关活动中，我们提供具有深刻营销理念的公关解决方案。公司主要承接房地产、汽车等行业大型公关活动，通过公关活动使我们的客户在品牌知名度、美誉度以及销售等方面得到提升和促进，曾服务于龙湖地产、保利地产、万达集团、国贸集团、联发集团、融信地产、阳光城集团等数十家大型房地产集团公司,诚邀有志之士加盟，共创大型公关机构服务平台。联系方式：0591-83302220",5000.0,7000.0,6000.0,福州-晋安区,3-4年经验,大专
公关活动策划,"五险一金,绩效奖金,专业培训,年终奖金,员工旅游,出国机会,定期体检","活动策划,会务/会展经理","岗位职责：,1、根据客户要求，收集项目相关的信息及资料。,2、组织及参与项目的创意构思，把握策划要点以及活动创意。,3、参与并协助完成项目策划中的主题、设计及内容等创意部分，并制作活动策划方案。,4、参与设计部门及执行部门的项目协作。,5、协助项目人员进行创意提案，保证项目的顺利进行。,任职要求：,1、新闻、广告、传播、市场营销等相关专业或本科及以上学历。,2、2-3年以上相关策划、文案工作及活动项目经验者优先考虑。,3、能够熟练使用OFFICE办公软件，对PPT使用精通，有较高的PPT排版能力。,4、有较强文案编辑能力，具备文字表现力及驾驭力。,5、有眼见、有思想，欢迎脑洞大开的你加入我们！",上海景桥文化传播有限公司,民营公司,150-500人,"公关/市场推广/会展,建筑/建材/工程",景桥会展集团TopBridge Expo Group是国际领先的集策划、设计、承建和运营管理为一体的全球会展营销服务商，集团通过了ISO9001:2015质量管理体系及ISO14001:2015环境管理体系认证。集团成立于2007年，总部位于上海，在北京、广州、深圳拥有子公司，并在汉诺威、洛杉矶、迪拜、莫斯科及新加坡设立了办事处，领先品质，全球服务。    景桥会展集团是中国展览馆协会资质单位，上海市会展行业协会副会长单位，中国展览馆协会展览工程一级资质。作为中国国际进口博览会指定搭建商，景桥会展集团拥有超过230位策划、设计和项目团队，20000平方米的制作工厂，350余位固定专业工人。在策划创意、承建管理和运营服务上具备世界级水准。2019年营业额超过3个亿，正筹备上市。    景桥自成立12年以来，屡获殊荣，先后荣获2011-2012上海优秀原创展示设计作品、2012年度中国十佳品牌展览工程企业、2013年全国金五星优秀会展服务供应商、2013优秀区域公关公司、2014年度中国十佳会展企业、2015年中国优秀外展搭建商、2016年中国会展领军搭建企业、2017年中国优秀主场承建商、2018年中国会展名优服务商以及2019壮丽七十周年-中国会展十大展陈创新奖等多项业界盛誉。    高山景行，桥达天下。景桥凭借深刻的客户需求洞察力，强大的设计能力，以及卓越的执行力，正日益成为客户选择、长期信赖乃至值得客户学习的品牌全球展览展示合作伙伴。    景桥认为：会展传播的本质，是创造有影响力的品牌环境，由受众主动传播。    诚挚欢迎有志之士投递简历：jingqiaoco@163.com,10000.0,15000.0,12500.0,上海-宝山区,1年经验,本科
文案/活动策划/运营,"五险一金,绩效奖金,专业培训,年终奖金,员工旅游,出国机会,定期体检","活动策划,会务/会展专员","职位描述：,1.完成客户活动传播方案的策划，提案，和项目管理执行；,2.为客户提供专业性的活动营销策略，并负责客户线下活动的服务和管理；,3.领导团队，有效安排和督导部分的工作分工和进展；,4.协调多方合作伙伴为客户提供专业优质服务。,任职要求：,1.本科以上学历，广告，公关，英语，会展，市场营销或相关专业毕业；,2.至少1年以上相关工作经验，有与大品牌或跨国公司合作的工作经历。,3.有快消品牌客户服务经验者优先考虑；,4.具备出色的沟通能力，流程管控能力，和项目执行力；,5.极强的组织管理能力，优秀的市场拓展和谈判能力，具有较强的人机沟通协调技巧；,6.具有高度的工作热情和责任感，能承受高强度的工作压力。 ",上海景桥文化传播有限公司,民营公司,150-500人,"公关/市场推广/会展,建筑/建材/工程",景桥会展集团TopBridge Expo Group是国际领先的集策划、设计、承建和运营管理为一体的全球会展营销服务商，集团通过了ISO9001:2015质量管理体系及ISO14001:2015环境管理体系认证。集团成立于2007年，总部位于上海，在北京、广州、深圳拥有子公司，并在汉诺威、洛杉矶、迪拜、莫斯科及新加坡设立了办事处，领先品质，全球服务。    景桥会展集团是中国展览馆协会资质单位，上海市会展行业协会副会长单位，中国展览馆协会展览工程一级资质。作为中国国际进口博览会指定搭建商，景桥会展集团拥有超过230位策划、设计和项目团队，20000平方米的制作工厂，350余位固定专业工人。在策划创意、承建管理和运营服务上具备世界级水准。2019年营业额超过3个亿，正筹备上市。    景桥自成立12年以来，屡获殊荣，先后荣获2011-2012上海优秀原创展示设计作品、2012年度中国十佳品牌展览工程企业、2013年全国金五星优秀会展服务供应商、2013优秀区域公关公司、2014年度中国十佳会展企业、2015年中国优秀外展搭建商、2016年中国会展领军搭建企业、2017年中国优秀主场承建商、2018年中国会展名优服务商以及2019壮丽七十周年-中国会展十大展陈创新奖等多项业界盛誉。    高山景行，桥达天下。景桥凭借深刻的客户需求洞察力，强大的设计能力，以及卓越的执行力，正日益成为客户选择、长期信赖乃至值得客户学习的品牌全球展览展示合作伙伴。    景桥认为：会展传播的本质，是创造有影响力的品牌环境，由受众主动传播。    诚挚欢迎有志之士投递简历：jingqiaoco@163.com,8000.0,10000.0,9000.0,上海-宝山区,1年经验,本科
活动策划经理,"五险一金,绩效奖金,专业培训,年终奖金,员工旅游,出国机会,定期体检","活动策划,市场企划专员","职位描述：,1.完成客户活动传播方案的策划，提案，和项目管理执行；,2.为客户提供专业性的活动营销策略，并负责客户线下活动的服务和管理；,3.领导团队，有效安排和督导部分的工作分工和进展；,4.协调多方合作伙伴为客户提供专业优质服务。,任职要求：,1.本科以上学历，广告，公关，英语，会展，市场营销或相关专业毕业；,2.至少1年以上相关工作经验，有与大品牌或跨国公司合作的工作经历。,3.有快消品牌客户服务经验者优先考虑；,4.具备出色的沟通能力，流程管控能力，和项目执行力；,5.极强的组织管理能力，优秀的市场拓展和谈判能力，具有较强的人机沟通协调技巧；,6.具有高度的工作热情和责任感，能承受高强度的工作压力。 ",上海景桥文化传播有限公司,民营公司,150-500人,"公关/市场推广/会展,建筑/建材/工程",景桥会展集团TopBridge Expo Group是国际领先的集策划、设计、承建和运营管理为一体的全球会展营销服务商，集团通过了ISO9001:2015质量管理体系及ISO14001:2015环境管理体系认证。集团成立于2007年，总部位于上海，在北京、广州、深圳拥有子公司，并在汉诺威、洛杉矶、迪拜、莫斯科及新加坡设立了办事处，领先品质，全球服务。    景桥会展集团是中国展览馆协会资质单位，上海市会展行业协会副会长单位，中国展览馆协会展览工程一级资质。作为中国国际进口博览会指定搭建商，景桥会展集团拥有超过230位策划、设计和项目团队，20000平方米的制作工厂，350余位固定专业工人。在策划创意、承建管理和运营服务上具备世界级水准。2019年营业额超过3个亿，正筹备上市。    景桥自成立12年以来，屡获殊荣，先后荣获2011-2012上海优秀原创展示设计作品、2012年度中国十佳品牌展览工程企业、2013年全国金五星优秀会展服务供应商、2013优秀区域公关公司、2014年度中国十佳会展企业、2015年中国优秀外展搭建商、2016年中国会展领军搭建企业、2017年中国优秀主场承建商、2018年中国会展名优服务商以及2019壮丽七十周年-中国会展十大展陈创新奖等多项业界盛誉。    高山景行，桥达天下。景桥凭借深刻的客户需求洞察力，强大的设计能力，以及卓越的执行力，正日益成为客户选择、长期信赖乃至值得客户学习的品牌全球展览展示合作伙伴。    景桥认为：会展传播的本质，是创造有影响力的品牌环境，由受众主动传播。    诚挚欢迎有志之士投递简历：jingqiaoco@163.com,10000.0,15000.0,12500.0,上海-宝山区,1年经验,本科
活动策划,"通讯补贴,节假日福利,生日福利,五险,加班补贴,项目提成","活动策划,文案/策划","岗位职责：,1、根据客户需求，构思、设计活动策划方案，为客户量身定做各种形式的策划方案；,2、针对活动要求撰写具体的策划案、制定预算及每项活动的费用及效果回报分析；,3、将活动策划方案转化为具体的执行方案，把控策划方案的现场管理，细化工作流程，严格按照时间节点和质量要求完成工作；,4、在充分了解设计需求的情况下与设计沟通协调把控方案视觉效果；,5、负责统筹安排项目团队的执行，与客户进行工作细节的对接。对各相关部门以客户需求为原则进行指导、督促及监督。, ,岗位要求：,1、大专以上学历，一年以上活动策划或广告公司同行业经验，具有房地产策划、会展策划等策划经验者优先；,2、有创新意识，善于捕捉与把握潮流信息；良好的演讲和沟通能力；熟悉操作PPT等办公软件和演示软件；具备一定的审美能力，文字语言功底强悍；；,3、有较强的独立工作能力及时间管理能力，工作效率高，能够有效的控制工作进度；,4、有一定公关表达能力；具有独立完成项目方案的撰写能力；具有一定的统筹执行能力；,5、对活动策划有浓厚兴趣，对工作热情，上进心强，抗压能力强。,公司待遇：,1、工作时间周一至周五；09：00--18：00，双休；,2、享受国家规定的节假日；,3、底薪+项目提成+客户开拓金,4、购买五险；享受国家规定的带薪年假,公司地址：广州市海珠区赤岗西路20号畅流工业园之9号楼401房,乘车路线：地铁3号线客村站D出口，步行约15分钟，附近公交车站：赤岗路口。",广州锦上添花文化传播有限公司,民营公司,少于50人,"公关/市场推广/会展,影视/媒体/艺术/文化传播",2010年，锦上添花文化传播公司萌芽广州，是一家集营销活动策划，创意策略传播，活动全程执行、演艺资源输出于一体的专业型活动服务公司，凭借创新、诚信、专业、务实的服务精神，赢得行业公信力。    随着公司不断发展，自2011年始，进入全方位活动营销领域，从幕后到前台，从制作到策划，服务于各类房地产商、大型卖场、汽车、家电、直销和快速消费品行业，矢志 “以持续创新策略为灵魂，以精良执行落地为根本，以挖掘活动事件影响力为己任”立市，年均承接各类活动200场+，全方位利用自有创意策划设计部、资源开发采购部、活动落地执行部、活动媒体宣传部、演艺事业部、物料制作部六位一体，迅速成长为华南地区排名前列的新锐活动营销机构。    一路走来，已与国际文化资源进出口、中国主流演艺经纪机构、大型国际品牌机构、主流传媒行业机构及文化、艺术、教育、财经、军事、收藏、时尚、体育、科技、音乐、风水、建筑、设计、美食名人等保持深度的合作关系，为公司在活动领域的发展夯实了基础，为创造活动价值提供了保障。值此公司发展之际，将更加秉持“洞察力、整合力、执行力、影响力” 的核心竞争优势，持续为客户创造活动价值，用专业激情服务精神及务实求真的创新理念在活动领域继续探索，务求用您对我们的信任让每场活动价值倍增。价值与原则锦上添花拒绝平凡，坚持“三创”创新（Innovate）：勇于探索、敢为人先创意（Originality）：无创意、不价值创造（Ceate）：想到一定做到，要做就做***招贤纳士：锦上添花重视人才，鼓励创新，倡导轻松和谐的工作氛围，为真正的人才提供优厚的待遇及广阔的发展空间！如果你是真英才、你唱戏，我搭台，只要你敢来！,5000.0,7000.0,6000.0,广州-海珠区,1年经验,大专
